{
  "$schema": "https://json-schema.org/draft/2020-12/schema",
  "$id": "https://api.noticebird.com/schema/feedback-report.v1.schema.json",
  "title": "FeedbackReport, schema version 1",
  "description": "The body of POST /v1/feedback. Fail-closed: no object accepts a property it does not list. The rules JSON Schema cannot express (no string holds U+0000, every number is finite, a timestamp names a moment that exists, the encoded report is at most 65536 bytes, its diagnostics at most 16384 and its userContext at most 8192, and the rules of the moment of submission) are in the README next to this file.",
  "type": "object",
  "additionalProperties": false,
  "required": [
    "schemaVersion",
    "reportId",
    "createdAt",
    "kind",
    "message",
    "app",
    "platform",
    "sessionId"
  ],
  "properties": {
    "schemaVersion": {
      "const": 1
    },
    "reportId": {
      "description": "Generated by the client, and its idempotency key: a replay with the same reportId must be the same report.",
      "$ref": "#/$defs/uuidV4"
    },
    "createdAt": {
      "description": "At submission at most 7 days old and at most 5 minutes in the future.",
      "$ref": "#/$defs/utcTimestamp"
    },
    "kind": {
      "enum": [
        "bug",
        "idea",
        "other"
      ]
    },
    "trigger": {
      "enum": [
        "manual",
        "shake",
        "errorScreen",
        "other"
      ]
    },
    "message": {
      "type": "string",
      "minLength": 1,
      "maxLength": 4000,
      "description": "Redacted by the client before it is sent; the server redacts it again."
    },
    "contact": {
      "type": "object",
      "additionalProperties": false,
      "required": [
        "email"
      ],
      "properties": {
        "email": {
          "type": "string",
          "minLength": 3,
          "maxLength": 254,
          "pattern": "^[^@\\s]+@[^@\\s]+$"
        }
      },
      "description": "Its presence is the reporter's consent to be contacted."
    },
    "app": {
      "type": "object",
      "additionalProperties": false,
      "required": [
        "name",
        "version",
        "build",
        "release"
      ],
      "properties": {
        "name": {
          "type": "string",
          "minLength": 1,
          "maxLength": 100
        },
        "version": {
          "type": "string",
          "minLength": 1,
          "maxLength": 50
        },
        "build": {
          "type": "string",
          "minLength": 1,
          "maxLength": 50
        },
        "release": {
          "type": "string",
          "minLength": 1,
          "maxLength": 160
        }
      }
    },
    "platform": {
      "type": "object",
      "additionalProperties": false,
      "required": [
        "name",
        "osVersion",
        "deviceClass"
      ],
      "properties": {
        "name": {
          "enum": [
            "android",
            "ios",
            "macos",
            "windows",
            "linux",
            "web",
            "unknown"
          ]
        },
        "osVersion": {
          "type": "string",
          "minLength": 1,
          "maxLength": 100
        },
        "deviceClass": {
          "type": "string",
          "minLength": 1,
          "maxLength": 100
        },
        "locale": {
          "type": "string",
          "pattern": "^[A-Za-z]{2,3}([_-][A-Za-z0-9]{2,8}){0,3}$",
          "maxLength": 35
        }
      }
    },
    "routeTemplate": {
      "type": "string",
      "pattern": "^/",
      "maxLength": 200
    },
    "sessionId": {
      "type": "string",
      "pattern": "^[A-Za-z0-9_-]{16,64}$"
    },
    "relatedEventId": {
      "description": "The eventId of one crash event: a UUID of any version, or none, in lower case.",
      "$ref": "#/$defs/uuid"
    },
    "user": {
      "description": "The unverified identity the client holds. Never shown as verified; refused on a regulatedStrict project, where identity comes only from reporterAssertion.",
      "type": "object",
      "additionalProperties": false,
      "minProperties": 1,
      "properties": {
        "id": {
          "type": "string",
          "minLength": 1,
          "maxLength": 100
        },
        "email": {
          "type": "string",
          "minLength": 3,
          "maxLength": 254
        },
        "name": {
          "type": "string",
          "minLength": 1,
          "maxLength": 200
        }
      }
    },
    "userContext": {
      "description": "The context the host supplies about its user: identity on purpose, never verified. One nested level; never an object in an array. Its compact UTF-8 JSON encoding is at most 8192 bytes. The server drops credentials and health values from it; refused on a regulatedStrict project, after user.",
      "type": "object",
      "minProperties": 1,
      "maxProperties": 32,
      "propertyNames": {
        "$ref": "#/$defs/userContextKey"
      },
      "additionalProperties": {
        "oneOf": [
          {
            "$ref": "#/$defs/userContextScalar"
          },
          {
            "$ref": "#/$defs/userContextArray"
          },
          {
            "type": "object",
            "minProperties": 1,
            "maxProperties": 32,
            "propertyNames": {
              "$ref": "#/$defs/userContextKey"
            },
            "additionalProperties": {
              "oneOf": [
                {
                  "$ref": "#/$defs/userContextScalar"
                },
                {
                  "$ref": "#/$defs/userContextArray"
                }
              ]
            }
          }
        ]
      }
    },
    "reporterAssertion": {
      "description": "A compact JWS signed by the consumer's backend, which vouches for the reporter. Verified by the server, never stored.",
      "type": "string",
      "minLength": 16,
      "maxLength": 4096,
      "pattern": "^[A-Za-z0-9_-]+\\.[A-Za-z0-9_-]+\\.[A-Za-z0-9_-]+$"
    },
    "trail": {
      "type": "array",
      "maxItems": 100,
      "items": {
        "$ref": "#/$defs/breadcrumb"
      },
      "description": "Oldest first; no item later than createdAt plus 5 minutes."
    },
    "diagnostics": {
      "description": "Content-free host diagnostics: groups of scalar values.",
      "type": "object",
      "maxProperties": 16,
      "propertyNames": {
        "$ref": "#/$defs/diagnosticKey"
      },
      "additionalProperties": {
        "type": "object",
        "maxProperties": 32,
        "propertyNames": {
          "$ref": "#/$defs/diagnosticKey"
        },
        "additionalProperties": {
          "$ref": "#/$defs/diagnosticValue"
        }
      }
    },
    "attachments": {
      "type": "array",
      "maxItems": 1,
      "items": {
        "$ref": "#/$defs/attachmentRef"
      },
      "description": "At most one screenshot in version 1, uploaded before the report is submitted."
    }
  },
  "$defs": {
    "uuidV4": {
      "type": "string",
      "pattern": "^[0-9a-f]{8}-[0-9a-f]{4}-4[0-9a-f]{3}-[89ab][0-9a-f]{3}-[0-9a-f]{12}$"
    },
    "uuid": {
      "type": "string",
      "pattern": "^[0-9a-f]{8}-[0-9a-f]{4}-[0-9a-f]{4}-[0-9a-f]{4}-[0-9a-f]{12}$"
    },
    "userContextKey": {
      "type": "string",
      "pattern": "^[A-Za-z][A-Za-z0-9_-]{0,63}$"
    },
    "userContextScalar": {
      "oneOf": [
        {
          "type": "string",
          "minLength": 1,
          "maxLength": 256
        },
        {
          "type": "number"
        },
        {
          "type": "boolean"
        }
      ]
    },
    "userContextArray": {
      "type": "array",
      "minItems": 1,
      "maxItems": 16,
      "items": {
        "$ref": "#/$defs/userContextScalar"
      }
    },
    "utcTimestamp": {
      "type": "string",
      "pattern": "^\\d{4}-\\d{2}-\\d{2}T\\d{2}:\\d{2}:\\d{2}(\\.\\d{1,6})?Z$",
      "description": "A UTC timestamp that names a moment that exists (no 13th month, no 25th hour)."
    },
    "breadcrumb": {
      "description": "Exactly the breadcrumb of a crash event.",
      "type": "object",
      "additionalProperties": false,
      "required": [
        "occurredAt",
        "category",
        "action",
        "level"
      ],
      "properties": {
        "occurredAt": {
          "$ref": "#/$defs/utcTimestamp"
        },
        "category": {
          "enum": [
            "bloc",
            "navigation",
            "http",
            "ui",
            "auth",
            "lifecycle",
            "system"
          ]
        },
        "action": {
          "type": "string",
          "minLength": 1,
          "maxLength": 100,
          "pattern": "^[a-z][a-z0-9_.-]*$"
        },
        "level": {
          "enum": [
            "debug",
            "info",
            "warning",
            "error",
            "fatal"
          ]
        },
        "data": {
          "type": "object",
          "additionalProperties": false,
          "maxProperties": 8,
          "properties": {
            "feature": {
              "$ref": "#/$defs/tagScalar"
            },
            "operation": {
              "$ref": "#/$defs/tagScalar"
            },
            "component": {
              "$ref": "#/$defs/tagScalar"
            },
            "connectivity": {
              "$ref": "#/$defs/tagScalar"
            },
            "foreground": {
              "$ref": "#/$defs/tagScalar"
            },
            "retryCount": {
              "$ref": "#/$defs/tagScalar"
            }
          }
        }
      }
    },
    "tagScalar": {
      "oneOf": [
        {
          "type": "string",
          "maxLength": 100
        },
        {
          "type": "number"
        },
        {
          "type": "boolean"
        }
      ]
    },
    "diagnosticKey": {
      "type": "string",
      "pattern": "^[a-z][a-zA-Z0-9_]{0,63}$"
    },
    "diagnosticValue": {
      "description": "A boolean, a finite number, a UTC timestamp, a lowercase UUID v4, or a token without spaces. Free text is not a diagnostic.",
      "oneOf": [
        {
          "type": "boolean"
        },
        {
          "type": "number"
        },
        {
          "$ref": "#/$defs/utcTimestamp"
        },
        {
          "$ref": "#/$defs/uuidV4"
        },
        {
          "type": "string",
          "minLength": 1,
          "maxLength": 64,
          "pattern": "^[A-Za-z0-9_.:+/-]+$",
          "not": {
            "anyOf": [
              {
                "$ref": "#/$defs/uuidV4"
              },
              {
                "$ref": "#/$defs/utcTimestamp"
              }
            ]
          }
        }
      ]
    },
    "attachmentRef": {
      "type": "object",
      "additionalProperties": false,
      "required": [
        "index",
        "contentType",
        "byteLength",
        "sha256"
      ],
      "properties": {
        "index": {
          "type": "integer",
          "minimum": 0,
          "maximum": 0
        },
        "contentType": {
          "enum": [
            "image/png",
            "image/jpeg",
            "image/webp"
          ]
        },
        "byteLength": {
          "type": "integer",
          "minimum": 1,
          "maximum": 5242880
        },
        "sha256": {
          "type": "string",
          "pattern": "^[0-9a-f]{64}$"
        }
      }
    }
  }
}
