{
  "schemaVersion": 1,
  "reportId": "6f1d2c3b-4a5e-4f60-8b7a-9c8d7e6f5a4b",
  "createdAt": "2026-10-29T14:03:12.418Z",
  "kind": "bug",
  "trigger": "errorScreen",
  "message": "Saving failed after I renamed the list.",
  "contact": {
    "email": "reporter@example.com"
  },
  "app": {
    "build": "412",
    "name": "justorganize",
    "release": "justorganize@1.8.0+412",
    "version": "1.8.0"
  },
  "platform": {
    "name": "android",
    "osVersion": "16",
    "deviceClass": "phone",
    "locale": "en-GB"
  },
  "routeTemplate": "/lists/:listId",
  "sessionId": "p_7Hq2xK9mR4tW1zY6",
  "relatedEventId": "0b6a4f1e-1c2d-4e3f-8a9b-0c1d2e3f4a5b",
  "user": {
    "id": "user_abc123",
    "email": "jane@example.com",
    "name": "Jane Doe"
  },
  "userContext": {
    "role": "owner",
    "beta": true,
    "seats": 5,
    "ratio": 0.5,
    "features": [
      "sharing",
      "widgets",
      3,
      false
    ],
    "plan": {
      "tier": "premium",
      "addons": [
        "export"
      ],
      "trial": false
    }
  },
  "reporterAssertion": "eyJhbGciOiJFZERTQSIsImtpZCI6InVua25vd24ta2V5In0.eyJzdWIiOiJ1c2VyX2FiYzEyMyIsImF1ZCI6InByb2plY3QtaWQiLCJpYXQiOjE3OTMyODI1OTIsImV4cCI6MTc5MzI4NjE5Mn0.AAAAAAAAAAAAAAAAAAAAAAAAAAAAAAAAAAAAAAAAAAAAAAAAAAAAAAAAAAAAAAAAAAAAAAAAAAAAAAAAAAAAAA",
  "trail": [
    {
      "occurredAt": "2026-10-29T14:02:40.112Z",
      "category": "navigation",
      "action": "route.push",
      "level": "info"
    },
    {
      "occurredAt": "2026-10-29T14:03:01.903Z",
      "category": "ui",
      "action": "list.rename",
      "level": "warning",
      "data": {
        "component": "list_title",
        "retryCount": 2,
        "foreground": true
      }
    }
  ],
  "diagnostics": {
    "sync": {
      "lastPullAt": "2026-10-29T14:01:55.000Z",
      "outboxPending": 3,
      "ratio": 0.25,
      "realtimeConnected": true,
      "spaceId": "0b6a4f1e-1c2d-4e3f-8a9b-0c1d2e3f4a5b",
      "build": "release+412"
    },
    "subscription": {
      "tier": "premium"
    }
  },
  "attachments": [
    {
      "index": 0,
      "contentType": "image/jpeg",
      "byteLength": 48213,
      "sha256": "5d41402abc4b2a76b9719d911017c592aa5f2c2e9b1c4f6a7d8e9f0a1b2c3d4e"
    }
  ]
}
