{
  "schemaVersion": 1,
  "reportId": "9a8b7c6d-5e4f-4a3b-8c2d-1e0f9a8b7c6d",
  "createdAt": "2026-10-29T14:03:12.418Z",
  "kind": "bug",
  "message": "The app showed an error screen when I opened a shared list.",
  "app": {
    "build": "412",
    "name": "justorganize",
    "release": "justorganize@1.8.0+412",
    "version": "1.8.0"
  },
  "platform": {
    "name": "android",
    "osVersion": "16",
    "deviceClass": "phone"
  },
  "sessionId": "p_7Hq2xK9mR4tW1zY6",
  "trigger": "errorScreen",
  "relatedEventId": "019a3f2e-8d41-7a77-9c5e-1f2a3b4c5d6e"
}
