{
  "schemaVersion": 1,
  "reportId": "7c9e6679-7425-40de-944b-e07fc1f90ae7",
  "createdAt": "2026-10-29T14:03:12.418Z",
  "kind": "idea",
  "message": "A dark theme for the widgets would be nice.",
  "app": {
    "build": "412",
    "name": "justorganize",
    "release": "justorganize@1.8.0+412",
    "version": "1.8.0"
  },
  "platform": {
    "name": "android",
    "osVersion": "16",
    "deviceClass": "phone"
  },
  "sessionId": "p_7Hq2xK9mR4tW1zY6"
}
